{
 "schema_version": 1,
 "generated_at": "2026-10-22T15:40:19+00:00",
 "generator": "soil_hydrology_update.py",
 "parcel": {
  "insee": "39160",
  "section": "ZP",
  "number": "0001",
  "idu": "39160000ZP0001",
  "commune": "Commenailles",
  "area_m2": 4634,
  "area_m2_geometry": 4606.5,
  "centroid": {
   "lat": 46.8039042,
   "lon": 5.450162
  },
  "bbox_wgs84": [
   5.44955812,
   46.80292294,
   5.45080225,
   46.80480487
  ],
  "geometry": {
   "type": "MultiPolygon",
   "coordinates": [
    [
     [
      [
       5.44977133,
       46.80292294
      ],
      [
       5.44955812,
       46.80297459
      ],
      [
       5.44956977,
       46.80302056
      ],
      [
       5.44969181,
       46.80328541
      ],
      [
       5.44970405,
       46.80331253
      ],
      [
       5.44979331,
       46.80348764
      ],
      [
       5.45002171,
       46.80394625
      ],
      [
       5.45024724,
       46.80434132
      ],
      [
       5.45047889,
       46.80475563
      ],
      [
       5.45047921,
       46.80475985
      ],
      [
       5.45046367,
       46.80480487
      ],
      [
       5.45080225,
       46.80480143
      ],
      [
       5.44977133,
       46.80292294
      ]
     ]
    ]
   ]
  },
  "geometry_source": {
   "provider": "IGN API Carto — module cadastre",
   "url": "https://apicarto.ign.fr/api/cadastre/parcelle?code_insee=39160&section=ZP&numero=0001",
   "retrieved_at": "2026-10-20T15:36:06.446197+00:00",
   "feature_id": "parcelle.3329810"
  }
 },
 "limits": "Une maille SAFRAN de 8 km ou un pixel Copernicus de 1 km ne constitue pas une mesure physique effectuée sur la parcelle. Ces modèles et observations servent à suivre la tendance locale ; le contrôle réel du sol sur place reste supérieur pour juger sa travaillabilité.",
 "conventions": {
  "null": "donnée absente ou drapeau producteur (voir flags)",
  "zero": "valeur réelle nulle",
  "status": [
   "FRESH",
   "STALE",
   "PARTIAL",
   "UNAVAILABLE",
   "UNAVAILABLE_AUTH",
   "ERROR",
   "DISABLED"
  ],
  "max_age_hours": {
   "sim": 48,
   "copernicus_swi": 72,
   "copernicus_ssm": 72,
   "era5_land": null,
   "rain_precipitation": 48
  },
  "validity_window_end": {
   "sim": {
    "days_after": 1,
    "utc_hour": 6
   },
   "copernicus_swi": {
    "days_after": 0,
    "utc_hour": 12
   },
   "copernicus_ssm": {
    "days_after": 1,
    "utc_hour": 0
   },
   "era5_land": {
    "days_after": 1,
    "utc_hour": 0
   },
   "rain_precipitation": {
    "days_after": 1,
    "utc_hour": 0
   }
  },
  "no_cross_source_average": true
 },
 "sources": {
  "sim": {
   "status": "FRESH",
   "source_date": "2026-10-21",
   "valid_until": "2026-10-22T06:00:00+00:00",
   "age_hours": 9.7,
   "max_age_hours": 48,
   "status_reason": "dernière donnée âgée de 9.7 h (≤ 48 h)",
   "messages": [],
   "product": "SIM2 quotidien (SAFRAN-ISBA)",
   "provider": "Météo-France",
   "dataset_id": "6569b27598256cc583c917a7",
   "spatial_resolution_m": 8000,
   "day_convention": "DATE J = cumul/moyenne ]J 06 UTC, J+1 06 UTC] (T, HU : 00–00 UTC ; TINF_H : 18–18 UTC)",
   "units": {
    "SWI": "1",
    "SSWI_10J": "1",
    "WG_RACINE": "m³/m³",
    "WGI_RACINE": "m³/m³",
    "PRELIQ": "mm",
    "PRENEI": "mm",
    "PE": "mm",
    "EVAP": "mm",
    "ETP": "mm",
    "DRAINC": "mm",
    "RUNC": "mm",
    "T": "°C",
    "TINF_H": "°C",
    "TSUP_H": "°C",
    "HU": "%",
    "PRELIQ+PRENEI": "mm"
   },
   "unit_notes": {
    "SWI": "Dictionnaire 2026 : unité « % », valeurs publiées sur 0–1. Non comparable en niveau au SWI Copernicus (%, satellite, T).",
    "SSWI_10J": "Sans unité ; négatif = plus sec que la normale du modèle. Période de référence non précisée par le dictionnaire."
   },
   "primary_grid": "8360_22090",
   "grids": [
    {
     "id": "8360_22090",
     "lambx_hm": 8360,
     "lamby_hm": 22090,
     "lat": 46.8392,
     "lon": 5.43194,
     "role": "parcel",
     "overlap_m2": 4614.1,
     "overlap_fraction": 1.0,
     "distance_m": 0.0,
     "latest": {
      "date": "2026-10-21",
      "values": {
       "SWI": 0.22,
       "SSWI_10J": -2.409,
       "WG_RACINE": 0.23,
       "WGI_RACINE": 0.0,
       "PRELIQ": 5.9,
       "PRENEI": 0.0,
       "PRELIQ+PRENEI": 5.9,
       "PE": 4.9,
       "EVAP": 1.0,
       "ETP": 0.6,
       "DRAINC": 0.3,
       "RUNC": 0.3,
       "T": 9.2,
       "TINF_H": 8.8,
       "TSUP_H": 10.7,
       "HU": 92.0
      }
     },
     "derived": {
      "anchor_date": "2026-10-21",
      "swi": {
       "latest": 0.22,
       "latest_date": "2026-10-21",
       "d7": 0.093,
       "d7_date": "2026-10-14",
       "delta_7d": 0.127,
       "trend": "rising",
       "stable_threshold": 0.02
      },
      "cumuls_mm": {
       "PRELIQ": {
        "24h": 5.9,
        "72h": 29.5,
        "7d": 34.0,
        "14d": 44.1
       },
       "PRENEI": {
        "24h": 0.0,
        "72h": 0.0,
        "7d": 0.0,
        "14d": 0.0
       },
       "PRELIQ+PRENEI": {
        "24h": 5.9,
        "72h": 29.5,
        "7d": 34.0,
        "14d": 44.1
       },
       "EVAP": {
        "7d": 5.4
       },
       "ETP": {
        "7d": 5.6
       },
       "PE": {
        "7d": 28.6
       },
       "DRAINC": {
        "7d": 1.5
       },
       "RUNC": {
        "7d": 1.0
       }
      },
      "missing_days": {}
     },
     "series": {
      "date": [
       "2026-08-23",
       "2026-08-24",
       "2026-08-25",
       "2026-08-26",
       "2026-08-27",
       "2026-08-28",
       "2026-08-29",
       "2026-08-30",
       "2026-08-31",
       "2026-09-01",
       "2026-09-02",
       "2026-09-03",
       "2026-09-04",
       "2026-09-05",
       "2026-09-06",
       "2026-09-07",
       "2026-09-08",
       "2026-09-09",
       "2026-09-10",
       "2026-09-11",
       "2026-09-12",
       "2026-09-13",
       "2026-09-14",
       "2026-09-15",
       "2026-09-16",
       "2026-09-17",
       "2026-09-18",
       "2026-09-19",
       "2026-09-20",
       "2026-09-21",
       "2026-09-22",
       "2026-09-23",
       "2026-09-24",
       "2026-09-25",
       "2026-09-26",
       "2026-09-27",
       "2026-09-28",
       "2026-09-29",
       "2026-09-30",
       "2026-10-01",
       "2026-10-02",
       "2026-10-03",
       "2026-10-04",
       "2026-10-05",
       "2026-10-06",
       "2026-10-07",
       "2026-10-08",
       "2026-10-09",
       "2026-10-10",
       "2026-10-11",
       "2026-10-12",
       "2026-10-13",
       "2026-10-14",
       "2026-10-15",
       "2026-10-16",
       "2026-10-17",
       "2026-10-18",
       "2026-10-19",
       "2026-10-20",
       "2026-10-21"
      ],
      "SWI": [
       0.035,
       0.049,
       0.11,
       0.096,
       0.082,
       0.092,
       0.083,
       0.073,
       0.066,
       0.068,
       0.062,
       0.057,
       0.052,
       0.048,
       0.048,
       0.044,
       0.047,
       0.082,
       0.071,
       0.061,
       0.054,
       0.05,
       0.045,
       0.041,
       0.04,
       0.038,
       0.036,
       0.034,
       0.032,
       0.03,
       0.028,
       0.027,
       0.025,
       0.024,
       0.023,
       0.022,
       0.021,
       0.019,
       0.016,
       0.019,
       0.02,
       0.019,
       0.019,
       0.017,
       0.016,
       0.027,
       0.093,
       0.094,
       0.107,
       0.105,
       0.098,
       0.095,
       0.093,
       0.091,
       0.086,
       0.086,
       0.088,
       0.101,
       0.152,
       0.22
      ],
      "SSWI_10J": [
       -2.411,
       -2.386,
       -2.298,
       -2.222,
       -2.162,
       -2.112,
       -2.096,
       -2.097,
       -2.125,
       -2.084,
       -2.117,
       -2.152,
       -2.206,
       -2.242,
       -2.305,
       -2.378,
       -2.422,
       -2.415,
       -2.398,
       -2.388,
       -2.378,
       -2.37,
       -2.355,
       -2.331,
       -2.304,
       -2.272,
       -2.235,
       -2.23,
       -2.223,
       -2.219,
       -2.205,
       -2.227,
       -2.255,
       -2.319,
       -2.397,
       -2.429,
       -2.496,
       -2.528,
       -2.576,
       -2.63,
       -2.686,
       -2.743,
       -2.789,
       -2.815,
       -2.82,
       -2.854,
       -2.808,
       -2.769,
       -2.708,
       -2.673,
       -2.626,
       -2.58,
       -2.531,
       -2.5,
       -2.515,
       -2.52,
       -2.541,
       -2.529,
       -2.537,
       -2.409
      ],
      "WG_RACINE": [
       0.208,
       0.208,
       0.218,
       0.218,
       0.215,
       0.216,
       0.215,
       0.214,
       0.213,
       0.213,
       0.212,
       0.211,
       0.21,
       0.21,
       0.209,
       0.209,
       0.209,
       0.215,
       0.214,
       0.212,
       0.211,
       0.21,
       0.209,
       0.209,
       0.208,
       0.208,
       0.208,
       0.208,
       0.208,
       0.207,
       0.207,
       0.207,
       0.206,
       0.206,
       0.206,
       0.206,
       0.206,
       0.206,
       0.206,
       0.205,
       0.206,
       0.206,
       0.206,
       0.205,
       0.205,
       0.205,
       0.213,
       0.216,
       0.216,
       0.217,
       0.217,
       0.216,
       0.216,
       0.215,
       0.215,
       0.214,
       0.214,
       0.216,
       0.217,
       0.23
      ],
      "WGI_RACINE": [
       0.0,
       0.0,
       0.0,
       0.0,
       0.0,
       0.0,
       0.0,
       0.0,
       0.0,
       0.0,
       0.0,
       0.0,
       0.0,
       0.0,
       0.0,
       0.0,
       0.0,
       0.0,
       0.0,
       0.0,
       0.0,
       0.0,
       0.0,
       0.0,
       0.0,
       0.0,
       0.0,
       0.0,
       0.0,
       0.0,
       0.0,
       0.0,
       0.0,
       0.0,
       0.0,
       0.0,
       0.0,
       0.0,
       0.0,
       0.0,
       0.0,
       0.0,
       0.0,
       0.0,
       0.0,
       0.0,
       0.0,
       0.0,
       0.0,
       0.0,
       0.0,
       0.0,
       0.0,
       0.0,
       0.0,
       0.0,
       0.0,
       0.0,
       0.0,
       0.0